{
  "schemaVersion": "1.0",
  "toolkitVersion": "3.0.1",
  "planId": "77777777-7777-4777-8777-777777777777",
  "createdAtUtc": "2026-08-22T15:00:00.000Z",
  "request": {
    "actionId": "SystemInfo",
    "actionName": "OS Version and Uptime",
    "readOnly": true,
    "targetMode": "Remote",
    "targets": [
      {
        "index": 0,
        "targetId": "t-cbf9596dcad9113727edd4e3",
        "name": "server01.example.com"
      }
    ],
    "transport": {
      "name": "WinRM",
      "authentication": "Kerberos",
      "useSsl": true,
      "psExecPath": null,
      "psExecSha256": null
    },
    "inputs": [],
    "policy": {
      "applied": false,
      "path": null,
      "fileSha256": null,
      "schemaVersion": null,
      "profileName": null,
      "decision": "NotApplied",
      "reasonCode": "NoPolicy"
    },
    "safety": {
      "preflight": false,
      "whatIf": false,
      "maxConcurrentJobs": 8,
      "retryCount": 0,
      "retryDelaySeconds": 3,
      "operationTimeoutMinutes": 30,
      "connectivityTimeoutSeconds": 5,
      "skipConnectivityCheck": false,
      "requiredConfirmationText": null,
      "targetListConfirmationRequired": false,
      "psExecConfirmationRequired": false,
      "identityMode": "CurrentWindowsIdentity"
    }
  },
  "approval": {
    "status": "Pending",
    "approvedBy": null,
    "approvedAtUtc": null,
    "reference": null,
    "planHash": "9389746c9a19cdfa780525b3159cb67d94f4c9be8587904d0ea8868e0055f948",
    "approvalHash": null
  },
  "planHash": {
    "algorithm": "SHA-256",
    "canonicalization": "WAT-PLAN-1",
    "value": "9389746c9a19cdfa780525b3159cb67d94f4c9be8587904d0ea8868e0055f948"
  }
}
